url,ano,title,content,author
ttps://www.lanacion.com.ar/economia/la-salud-mental-se-pone-a-prueba-todos-los-dias-en-el-mundo-laboral-nid1581278/,2013,La salud mental se ponea prueba todos los días en el mundo laboral,"Este segundo congreso que trata las problemáticas del mundo laboral y su reflejo en la psicología humana dejó como conclusión, una vez más, cuán importante es el trabajo en la vida de las personas y el sufrimiento que trae aparejado cuando la persona siente que está fuera de lugar o que está haciendo alguna actividad reñida con su propia ética. Ya en 2012, Christophe Dejours, titular de la cátedra Psicoanálisis-Salud-Trabajo en el Conservatoire National des Arts et Métiers de Francia, había visitado la Argentina, ocasión en que fue nombrado profesor honorario de la UBA. En esa oportunidad habló sobre La centralidad del trabajo y su relación con la salud mental. En esta nueva ponencia, como apertura del segundo congreso organizado por la Cátedra II de Psicología del Trabajo, Dejours fue un poco más allá. ""No hay neutralidad en el trabajo respecto de la salud mental"", dice este profesor citado recurrentemente durante las diversas exposiciones. El sufrimiento fue su tema. ""El trabajo no es un decorado externo del funcionamiento psíquico individual"", comienza. ""Hombres y mujeres no están en posiciones idénticas en este sentido porque hay ¿relación?relaciones de dominación, y eso conmociona el funcionamiento psíquico."" Según Dejours, para escalar posiciones algunas mujeres toman una actitud más viril, una actitud de hombre. ""Para ellas hay pruebas más exigentes que para los hombres, por lo que se da una pugna entre su identidad sexual y la social. Pierden una parte de su femineidad."" Pero este dejar de ser uno mismo no sólo es un problema femenino. ""El sufrimiento ético, es decir, consentir las prácticas impropias para conservar el trabajo, lleva a conflictos familiares, agotamiento, insomnio, pero lo peor es que la persona se traiciona a sí misma."" Otro tema recurrente para él es la evaluación de desempeño, que no llega a la profundidad de quién es cada uno y lo que realmente rinde. ""Los métodos de medición son falsos y siempre lo serán. Lo esencial del trabajo es subjetivo, no tangible. Vale el reconocimiento del trabajo y el juicio de los colegas."" Michelle Aslanides, directora de la especialización en ergonomía de la UTN FRBA, presentó el caso de la reorganización del trabajo de los comerciales de la empresa Telefónica Orange, que era nada menos que la ex France Telecom, compañía que sufrió más de 45 de suicidios por parte de sus trabajadores entre 2008 y 2010. ""En determinadas empresas hay factores que son un caldo de cultivo para el sufrimiento derivado de la falta de reconocimiento al trabajador"", dice Aslanides. ""Las personas sufren porque los valores de la empresa dejan de ser los suyos y se les aplican consignas de trabajo que no concuerdan con su manera de pensar."" Aslanides realizó una auditoría junto a tres colegas francesas a raíz del pedido de un Comité de Higiene, Seguridad y Condiciones de Trabajo formado por delegados de diversos sindicatos, el director regional y sus distintos asesores. ""La auditoría que nos pidieron se debía a que se estaba implementando una reorganización del trabajo que, según los delegados, podía traer riesgos para la salud."" ""Nosotros demostramos que ese riesgo estaba relacionado con la falta de sentido de las nuevas medidas de organización que llevaría a los trabajadores a brindar un peor servicio y a enfermarse por ese motivo."" Se habían puesto en marcha según la ergónoma (especialista en el análisis del trabajo y en el diseño de soluciones a los problemas identificados), quien recopiló más de 350 testimonios, diversos métodos para lograr que los trabajadores se retirasen de la empresa. Uno de ellos era llevar su trabajo dentro de un radio de acción de 300 kilómetros. ""Vimos que se trataba de mobbing, una manera encubierta de despedir que lleva consigo un gran sufrimiento. "" Después de la intervención del Ministerio de Trabajo de Francia, en 2009 renunció Didier Lombard, el número dos de la empresa y fue demandado judicialmente por acoso moral. Dentro de la gran cantidad de especialistas que analizaron diversas temáticas, Patricio Nusshold, doctor en psicodinámica del trabajo, estudió la complicada dinámica laboral de los call centers. ""Hace muchos años que sabemos que la forma en que está organizado el servicio impide que se haga lo que se tiene que hacer"", dice Nusshold. Una vez más, el trabajo reñido con la propia ética del empleado conspira contra la salud mental porque ""se le pide al trabajador que haga algo que considera que está mal"". Es decir, se le fijan metas que están relacionadas no con la lógica del trabajo, sino sólo con la lógica de la productividad. ""Para los trabajadores de call centers, la lógica se transforma en guiones que tienen que repetir y que son grabados. Ellos afirman que si pudieran decir lo que realmente creen, se resolverían mejor los problemas y la empresa tendría mejores resultados."" Finalmente, Daniela Lucena, doctora en Ciencias Sociales, hizo un llamado a que el arte y la creatividad estén presentes en la actividad diaria, para que ""recuperemos la capacidad creadora que nos ponga de manifiesto como seres únicos y diversos"".",Paula Urien
https://www.lanacion.com.ar/politica/susana-freydoz-fue-trasladada-a-una-clinica-portena-de-salud-mental-nid1583328/,2013,Susana Freydoz fue trasladada a una clínica porteña de salud mental,"Susana Freydoz, condenada a 18 años de prisión por el asesinato de su marido y gobernador rionegrino, Carlos Soria, fue trasladada esta mañana a una clínica de salud mental en el barrio porteño de Almagro, por disposición de la justicia. Su hijo e intendente de General Roca, Martín Soria, criticó hoy a los magistrados y a los peritos que trabajaron en la causa al cuestionar que ""hace un mes dijeron que mi madre estaba sana, ayer piden que la trasladen a una clínica psiquiátrica"". La mujer, que se encontraba internada en el hospital de Cipolletti, viajó esta mañana junto a su hija María Emilia en un avión sanitario que la trasladó hacia esta ciudad, donde fue alojada en la clínica privada Avril, especializada en adicciones . La medida fue dispuesta por el Servicio Penitenciario Provincial con la aprobación de la Cámara Primera del Crimen, luego de que Freydoz intentó suicidarse en la habitación del centro hospitalario en el que estaba alojada, señaló el diario Río Negro. En diálogo con la radio LU19, el intendente roquense criticó a los magistrados al señalar que ""hace apenas un mes, dijeron que mi madre estaba absolutamente sana y que tenía que cumplir la condena como cualquier chico que roba un estéreo"". ""En el día de ayer, en horas del mediodía, solicitaron al Servicio Penitenciario de la provincia que la traslade a una clínica psiquiátrica de Buenos Aires en calidad de detenida. Es decir, ¿está loca o no está loca? Los peritos del Cuerpo Médico Forense, ¿dónde se recibieron?"", se preguntó. Soria consideró que los camaristas ""no hicieron justicia por la memoria de mi padre; en realidad se estaban vengando de mi padre y su familia. Por eso me parece que es una vergüenza lo que hicieron y lo que están haciendo"". Por otra parte, advirtió que ""lo que está buscando la Justicia es sacarse la culpa de encima y patear su propia responsabilidad"", al referirse a la imputación de 60 trabajadores sanitarios por el intento de suicidio de Freydoz. ""Este intento de responsabilizar a los médicos y enfermeros, de imputarles una conducta a sesenta trabajadores de un hospital por un intento de suicidio de una paciente detenida y alojada ahí por decisión del poder judicial de Río Negro me parece que es una actitud reprochable y vergonzosa"", agregó. Agencia DyN",NA
https://www.lanacion.com.ar/buenos-aires/trabajadores-buscan-reconstruir-el-taller-dentro-del-hospital-borda-nid1582610/,2013,Trabajadores buscan reconstruir el taller dentro del Hospital Borda,"Trabajadores de los Talleres Protegidos de Rehabilitación en Salud Mental, junto a vecinos y organizaciones sociales juntan fondos para reconstruir el taller Nº 19 que funcionaba en el Hospital Borda, donde hasta julio del año pasado funcionó el taller N°19, y que fuera demolido el pasado 26 de abril por el gobierno porteño en el marco de una represión de la Policía Metropolitana que dejó un saldo de 50 heridos. ""Vamos a hacer un taller igual al que se demolió. Era un taller antiguo, un monumento histórico el que tiraron abajo, por lo tanto vamos a intentar reconstruirlo con las mismas características que tenía"", aseguró Ernesto Balbiano, Secretario Adjunto de la Comisión Interna de ATE Talleres Protegidos. El diseño de los planos estará a cargo del ex decano de la Facultad de Arquitectura y miembro de Carta Abierta, Jaime Sorín, quien confirmó a Télam que realizará esta tarea ""como colaboración"". ""Todavía no tenemos plazos establecidos, recién vi cómo quedó el terreno. Me voy a poner a trabajar con la gente del taller e iremos ajustándonos a sus necesidades, porque son ellos los que lo van a usar"", afirmó. Para financiar este proyecto, la comisión interna tiene previsto realizar distintas actividades a beneficio y la apertura de una cuenta para donaciones en el Banco Nación. ""El 2 de junio se hace una actuación a beneficio en el Teatro Fray Mocho, para empezar a juntar los fondos"", contó Ricardo Talavera, secretario gremial de la Comisión Interna de ATE Talleres Protegidos. Los dirigentes gremiales creen que que la convocatoria será exitosa. ""Hemos recibido la solidaridad de un montón de gente, inclusive de distintos sectores sociales y políticos que están dispuestos a brindar una colaboración"", dijeron. Paralelamente a esta medida, están juntando firmas para que la Legislatura ordene no sólo la reconstrucción de este taller, sino además la cancelación del proyecto para la construcción de un Centro Cívico dentro del predio del hospital psiquiátrico. Más allá de la suerte que tenga esta otra iniciativa, los delegados están decididos a seguir adelante con la reconstrucción del taller 19 por sus propios medios. No obstante, reconocen que ""será difícil"" que el gobierno de la Ciudad devuelva administrativamente allí el taller. ""Posiblemente tengamos que hacer un emprendimiento productivo con los pacientes, para que ellos puedan hacer la tarea y cobrar. Pero siempre vamos por la de máxima, que es que vuelvan los compañeros y los pacientes a trabajar ahí"", aseguró Balbiano. El taller protegido intrahospitalario del Borda es uno de los 19 que integran el sistema de Talleres Protegidos de Rehabilitación en Salud Mental que dependen de la Dirección General de Salud Mental del Ministerio de Salud de la CABA, y cuenta con tres secciones: herrería, carpintería y pintura. ""Ahí se hacían muebles para los hospitales de la Ciudad de Buenos Aires: los fabricaban los pacientes junto con nosotros, que monitoreamos y nos vinculamos con ellos a través del trabajo, para que se vayan resocializando y recuperando sus habilidades"", agregó Balbiano. Desde 1984 y hasta el año pasado, el taller funcionó en uno de los galpones del Hospital Borda, y aunque las autoridades del gobierno porteño aseguran que entonces no fue cerrado sino ""relocalizado"" los trabajadores denuncian que, en todo caso, el nuevo local de la calle Brandsen 2665 ""funciona sin pacientes"", que son la razón de ser de la institución. ""Cuando se cerró este taller, los seis compañeros que trabajaban ahí fueron administrativamente obligados a concurrir, sin tareas, al nuevo taller, que no estaba terminado, y por eso hasta el día de hoy sigue sin pacientes, por lo que son los mismos docentes los que están haciendo camas, herrería, pintura"", contó. Según Balbiano, ""hicieron un taller a las apuradas, por eso cuando prendés una máquina no podés hablar ni escuchar y el ruido supera todos los límites posibles, por lo que tampoco pueden ir los pacientes"". Al momento de su cierre, en el lugar se desempeñaban 7 monitores y 13 pacientes, pero el lugar llegó a albergar a 35 pacientes. Uno de los 6 trabajadores del Taller Protegido N19, Humberto Herrera, aseguró que el grupo ""apoya todas las actividades que impliquen devolver su actividad al taller 19, pero el que lo tiene que reconstruir es quien lo destruyó"". ""Actualmente no concurren pacientes porque no está terminado el acceso que conecta el local con el hospital, para que los pacientes puedan ingresar sin salir del predio. Yo tengo 24 años en esta institución, mi vocación es muy fuerte y ya hace casi un año que estamos sin poder hacer lo que nos gusta y para lo que nos contrataron"", dijo.",NA
https://www.lanacion.com.ar/buenos-aires/daniel-chain-dijo-que-no-habia-orden-judicial-para-impedir-la-demolicion-en-el-hospital-bord-nid1579757/,2013,Daniel Chaín dijo que no había orden judicial para impedir la demolición en el Hospital Borda,"El ministro de Desarrollo Urbano porteño, Daniel Chaín, dijo hoy en la Legislatura que no había orden judicial para impedir la demolición en el Hospital Borda y aseguró que ""se cumplió el protocolo"", mientras diputados de la oposición advirtieron que hubo una ""decisión política"" de ""actuar en forma clandestina"" y pidieron su renuncia. Chaín es el segundo funcionario del gobierno de Mauricio Macri que concurre a la Legislatura para referirse al violento accionar de la Policía Metropolitana en el hospital, tras la interpelación realizada el 27 de abril al ministro de Seguridad, Guillermo Montenegro. El funcionario aseguró que ""jamás"" dio ""una orden a la Policía Metropolitana"", afirmó que lo que sí hizo fue pedir la presencia de la fuerza en el hospital el día de la demolición del Taller Protegido 19 y manifestó que ""la violencia jamás resuelve los conflictos, ni siquiera disminuye sus consecuencias"". Antes de comenzar su exposición, al mediodía, Chaín escuchó la palabra de gremialistas y trabajadores del centro de salud mental, que pidieron su renuncia y la de Montenegro, y advirtieron que irán ""otra vez al paro"", según dijo el secretario adjunto de CTA y delegado de la comisión interna del Borda, Marcelo Frondizi. Chaín aseguró que ""se cumplieron los protocolos"" para la demolición del taller, cuya construcción tiene asbesto, y manifestó que ""no había topadoras"", tras una intervención del presidente de la comisión de Salud, Jorge Selser, quien había manifestado que ""no se cumplieron los protocolos para la demolición"". ""No tuvimos un muerto de casualidad"" por el violento accionar de la Metropolitana en el marco de la protesta por la demolición del taller, expresó Selser, y dijo no tener ""claros los objetivos del gobierno respecto de las obras que se realizan para construir el Centro Cívico"". El ministro, en ese sentido, sostuvo que ""desde el 2008 a la fecha cuando hablamos de esto hemos señalado el espacio"" para la construcción del Centro Cívico y afirmó que ""hasta el momento, en estos cinco años no hubo ninguna propuesta alternativa"". El diputado de Buenos Aires para Todos, Fabio Basteiro, uno de los heridos durante la represión policial del 26 de abril en el hospital, pidió que se ""investigue"" a la fuerza y manifestó que ""todavía no pueden reconocer lo que pasó. Dicen que Montenegro dio la orden y Montenegro dice que la orden la dio Chaín. Todos mienten"". El diputado del Frente Progresista Popular y ex jefe de Gobierno, Aníbal Ibarra, advirtió que hubo una ""decisión política"" del gobierno de Mauricio Macri de ""actuar en forma clandestina"", en un procedimiento ""ilegal desde el principio hasta el fin"". ""No se puede hablar de violentos, los violentos fueron los del gobierno de la ciudad"", expresó el legislador, y afirmó que el gobierno de Macri ""está emulando a (el ex intendente porteño)Carlos Grosso. El tomó una escuela, le sacó un pedazo e hizo un negocio. Y ustedes le sacan un pedazo a un hospital"". Chaín, por su parte, manifestó que ""no había orden judicial que impidiera el inicio de los trabajos"" para la demolición, afirmó que ""siempre respetamos las decisiones judiciales"" y dijo que dispuso ""las tareas para el 26 (de abril) porque se nos había informado que no existían estas órdenes"". La legisladora por la Coalición Cívica, Rocío Sánchez Andía, sostuvo que la administración de Macri tiene una ""voracidad absoluta por los terrenos del Borda"", sin avanzar en un ""desarrollo integral"", y expresó que ""el Centro Cívico no puede construirse en ese lugar"". El ministro, en tanto, aseguró que ""de ninguna manera la apreciación económica de los terrenos (de la zona del Borda) es el objetivo"" de los planes de construcción en el hospital. El legislador kircherista Juan Cabandié afirmó que el ministro ""es responsable directo de la represión en el Borda"" y manifestó que ""ni en un hecho bélico se puede tocar un hospital"". Agencia DyN",NA
https://www.lanacion.com.ar/espectaculos/cine/rigoleto-en-apuros-nid1577951/,2013,Rigoleto en apuros,"Ficha técnica: Rigoleto en apuros (Quartet, Reino Unido/2012, hablada en inglés) / Dirección: Dustin Hoffman / Guión: Ronald Harwood, sobre su pieza teatral / Fotografía: John de Borman / Música: Dario Marianelli / Edición: Barney Pilling/ Diseño de producción: Andrew McAlpine / Elenco: Maggie Smith, Tom Courtenay, Billy Connolly, Pauline Collins, Michael Gambon, Sheridan Smith, Gwyneth Jones / Distribuidora: Diamond / Duración: 98 minutos / Calificación: apta para todo público Nuestra opinión: muy buena Se puede entender por qué esta pieza de Ron Harwood sedujo a Dustin Hoffman al punto de hacerlo concretar por fin su debut en la dirección. Es una obra que habla de artistas veteranos, retirados de su profesión, pero todavía apasionados por ella, una historia que no esconde las sombras crepusculares de la vejez, pero prefiere rescatar las pequeñas chispas que se conservan en la voluntad de vivir y son capaces de disiparlas; una encantadora y emocionante pieza de cámara de humor agridulce, más divertida que melancólica, que era necesario recrear con mucho amor y con la contribución indispensable de un conjunto de intérpretes formidables cuya familiaridad con las experiencias y los sentimientos de los personajes que encarnan los relevaban de cualquier artificio. Buena parte de ese ánimo lo recogió Hoffman de los intérpretes que quiso como habitantes de esta casa Beecham de ficción: son viejos artistas británicos de la lírica y otros géneros, incluida una ex estrella como Gwyneth Jones. El envidiable escenario de la Hedsor House en Buckinghamshire favorecido por el elegíaco tono otoñal de la fotografía de John de Borman presta el ambiente; el resto lo pone la sensibilidad de Hoffman para concertar los valiosos elementos con que cuenta. La pintura de la vida en ese hogar es idílica: los residentes pasan el tiempo haciendo música, cantando, dibujando, leyendo en el extenso parque o en las suntuosas salas y tanto los arrebatos donjuanescos del barítono como los problemas de salud en una comunidad con tan alto promedio de edad son parte de la rutina. También lo son las típicas manifestaciones de competencia entre artistas, sólo exacerbadas con la llegada de la pretenciosa diva snob a la que Maggie Smith presta todo su carisma y su talento. Con ella, dos líneas se cruzan para componer el sencillo armazón dramático que se apoya en diálogos ingeniosos: por un lado su reencuentro con Courtenay, uno de sus ex maridos, cuya relación no concluyó en buenos términos; por otro su negativa a volver a cantar en una gala que este año se hace urgente para conseguir los fondos que evitarán el cierre del establecimiento. Rencillas, algún tropiezo en la salud mental de la mezzo (Pauline Collins, admirable), ciertas clases sobre ópera que Courtenay intercambia con jóvenes expertos en hip hop y la preparación de la famosa gala contribuyen al encanto del relato. Por supuesto, el final es con el cuarteto de Rigoletto , que Hoffman, en atinada decisión, registra desde fuera de la mansión mientras añade un último homenaje durante los titulos del final, que nadie se querrá perder para no dejar de escuchar la maravillosa música de Verdi.",Fernando López
https://www.lanacion.com.ar/politica/las-bovedas-de-los-kirchner-un-rumor-que-ya-habia-circulado-en-2007-nid1581044/,2013,"Las bóvedas de los Kirchner, un rumor que ya había circulado en 2007","La historia de las bóvedas de los Kirchner en su casa de Santa Cruz no es nueva. Ya circulaba en 2007, cuando cuando un hombre volcó un camión frente a la casa familiar del entonces presidente Néstor Kirchner en Río Gallegos. Francisco Olivera recuerda el incidente en su columna Empresarios & Cía. de hoy, titulada ""La gran pregunta es dónde están los billetes"". El sábado 28 de abril de 2007, a la mañana, José Walter Mansilla Alarcón, un chileno de 33 años, agente de seguridad de una empresa, robó un camión Scania de gran porte, recorrió en forma descontrolada unas 30 cuadras, chocó diez autos, dejó siete personas heridas y volcó el camión frente a la casa de los Kirchner, ante una fuerte custodia de Gendarmería. Las crónicas locales cuentan que cuando salió del camión, ileso, gritó: ""¡Hay que matar al nazi!"". Indagado después en el Centro de Salud Mental y por la Policía, admitió que lo que quería era impactar en las bóvedas y cajas fuertes de la casa. El entonces ministro del Interior, Aníbal Fernández, había hablado de atentado . Lo concreto es que la historia quedó en la nada. Los peritajes psiquiátricos indicaron que Mansilla Alarcón no podía dirigir su conducta y que no estaba en condiciones de enfrentar un proceso penal. Todos dieron por sentado que el hombre fantaseaba. De acuerdo a lo que anticipó el periodista Jorge Lanata en su programa de radio, este domingo difundirá, en su programa Periodismo Para Todos, en El Trece, planos y testimonios que confirmarían la existencia de recintos en la vivienda de la presidenta Cristina Kirchner especialmente adaptados para contener objetos de valor o, incluso, dinero en efectivo. Los rumores de la existencia de bóvedas o espacios para custodiar dinero se conocieron en medio de denuncias de supuesto lavado de dinero del empresario santacruceño Lázaro Báez, ligado a los Kirchner y contratista del Estado.",NA
https://www.lanacion.com.ar/espectaculos/ante-las-versiones-de-su-renuncia-a-radio-10-oscar-gonzalez-oro-eligio-el-silencio-nid1580317/,2013,"Ante las versiones de su renuncia a Radio 10, Oscar González Oro eligió el silencio","Hoy a la mañana, el futuro de Oscar González Oro en Radio 10 era incierto. A las 9, el conductor hizo el pase con Chiche Gelblung como es su costumbre y empezó su ciclo El oro y el moro como si nada hubiese pasado el día anterior. Ayer, Oro escribió un extraño posteo en su Facebook que luego borró, donde hablaba de ""una decisión importante"" por su salud física y mental que tenía que tomar esa misma noche e iba a informar hoy. Las versiones no tardaron en aparecer y Twitter fue protagonista en este misterio, todos opinaban sobre si el conductor estaba amenazando con dejar el programa o no. Las especulaciones estuvieron presentes en las redes sociales: ¿Diría algo sobre su partida de Radio 10 como había prometido ayer, o lo pasaría por alto?. La decisión del conductor fue mantener el tema alejado de su programa. No hizo referencia en ningún momento a los rumores, ni a su mensaje publicado en Facebook. La pelea por el rating radial está cada día más parecida a la del mundo televisivo. La polémica se había instalado desde hace un tiempo, cuando el histórico conductor, Oscar González Oro, fue sacado del podio, junto a la radio que desde hace años que viene siendo la más escuchada (Radio 10). Tendencia que viene dándose desde febrero de 2013, con la incorporación de Jorge Lanata en el mismo horario en otro dial. ¿El culpable? Radio Mitre. Este año la emisora cambió casi toda su programación (casi, no toda), con la incorporación de Marcelo Longobardi (de 6 a 9) la balanza terminó de volcarse a favor de la radio del Grupo Clarín. En la segunda mañana Oro ( El oro y el moro ) compite directamente con Jorge Lanata ( Lanata sin filtro ). Si bien el cambio fue paulatino, este giro cada día se hace más evidente. En las mediciones de abril , Lanata consiguió un promedio de share del 42%, mientras que Oro, el 21%.",NA
